"post_id","title","description"
"1949","NüVoices Podcast #26: Di Wang on LGBTQ rights and representation in China","Di Wang, a feminist researcher and Ph.D. candidate at the University of Wisconsin–Madison, joins NüVoices to discuss LGBTQ rights, representation, and community terminology in China."
"1969","NüProfile: Madeline Leung Coleman on diaspora, feminism and freelance writing","Writer and editor Madeline Leung Coleman discusses her Chinese diaspora identity, the responsibilities of diaspora artists, feminism, and building a career in freelance writing."
"1983","Why is China still so reluctant to help us find our birth parents?","A Chinese adoptee raised in Quebec examines why China's government remains reluctant to help international adoptees find their birth families, decades after the One-Child Policy."
"1987","Opinion: In Hong Kong, the government is weaponising sex to downplay its failures","Sophie Mak examines how Hong Kong's alcohol ban at eateries, justified by claims about intimacy, reflects a pattern of using sex-related narratives to deflect from questionable policy decisions during the coronavirus pandemic."
"2017","NüVoices Podcast #27: U.S.-China cyber competition and cooperation with Julia Voo","Julia Voo of Harvard's China Cyber Policy Initiative discusses U.S.-China cyber competition, the Digital Silk Road, international technical standards, and Track II diplomacy efforts to mitigate cyber confrontation."
"2021","NüVoices Podcast #28: Coronavirus and the racism epidemic, with Sophie Lu and Jessie Tu","NüVoices chair Joanna Chiu speaks with co-founder Sophie Lu and author Jessie Tu about the rise in anti-Asian racism during the COVID-19 pandemic and how Asian communities and allies can respond to hate crimes amid a global health crisis."
"2040","Film: Outcry and Whisper","A documentary filmed over eight years, Outcry and Whisper explores women's resistance against political violence and harassment in Chinese and Hong Kong society through interviews, animation, and archives."
"2056","NüVoices Podcast #30: Foreign correspondence and China, with Megha Rajagopalan","Megha Rajagopalan, international correspondent for BuzzFeed News, joins Chenni Xu to discuss her reporting career across China and the Middle East, and the evolving landscape of foreign correspondence and journalism in China."
"2073","China's #MeToo: In literature and reality, the patriarchy keeps women from helping women. But they're fighting back.","In both Chinese literature and real life, patriarchal systems discourage women from supporting each other, but the #MeToo movement has sparked new forms of resistance against harassment and censorship."
"2077","Ferkat Jawdat is risking everything to speak out about China's crackdown on Uyghurs","Uyghur American activist Ferkat Jawdat shares how his advocacy against China's persecution of Uyghurs in Xinjiang has put his family at risk, including his mother's detention in a re-education camp."
"2119","NüVoices Podcast #31: Seeking creativity through multimedia journalism with Yuan Ren","Journalist Yuan Ren discusses her shift from print to broadcast media and shares advice on multimedia journalism with NüVoices chair Joanna Chiu. They also reflect on building careers in Western media as women of Chinese descent."
"2125","Chinese opera is being revitalized—with a gender twist","A visit to a mountain village in Ninghai reveals Boar-Tooth Opera, a rare regional form of Chinese traditional theater being kept alive with unexpected gender dynamics in its modern revival."
"2130","Freelance: How to pitch Ariana magazine","A guide to pitching freelance feature ideas to Ariana, a print and digital magazine covering social justice issues in Hong Kong, Macao, and greater Asia, including topic guidelines and editorial preferences."
"2138","China, the World, and the COVID Story: How We Got Here and What Lies Ahead","A digital summit co-organized by Chinese Storytellers, NüVoices, and Young China Watchers featuring three webinars on the coronavirus pandemic and its geopolitical implications for China and the world."
"2149","Resources for China watchers to fight anti-Black racism","A curated collection of resources for China watchers to engage in anti-Black racism efforts, compiled by NüVoices members to encourage solidarity and intersectional awareness within Asia-focused communities."
"2174","How women artists are navigating China's complex feminist landscape","Luise Guest examines how women artists in China engage with feminism, tracing the movement from revolutionary figures like Qiu Jin to contemporary debates over its relevance and meaning."
"2194","NüVoices Podcast #32: Creative entrepreneurship with Qian Zhang","Qian Zhang, cross-border creative entrepreneur and founder of tea brand The Puer Movement, discusses her time at Alibaba's Global Leadership Academy, bridge-building across cultures, and her experience at Harvard Business School."
"2209","Our summit on China and the COVID Story with Chinese Storytellers and Young China Watchers was a sold-out success","NüVoices, Chinese Storytellers, and Young China Watchers hosted a sold-out digital summit exploring the geopolitical, cultural, and media dimensions of the COVID-19 pandemic through three expert panels."
"2243","UK to review Hong Kong British National Overseas status, but domestic violence victims are left out of the discussion","The UK announces a review of British National Overseas status rights for Hong Kong passport holders amid Beijing's national security law, but advocates say domestic violence victims remain excluded from the discussion."
"2312","NüVoices Podcast #34: April Zhu on reporting from Nairobi, part 1","April Zhu, a freelance journalist based in Nairobi, discusses her reporting on gender, urban inequality, and China-Kenya relations with NüVoices board member Cindy Gao."
"2295","Hu Jie: The Chinese documentary filmmaker exposing the harsh realities of early Communist Party rule","Chinese documentary filmmaker Hu Jie is known for his trilogy on Maoist China, documenting the realities of the Great Leap Forward and Cultural Revolution despite government pressure."
"2318","NüVoices Podcast #35: The nation of diaspora: April Zhu on reporting from Nairobi, part 2","April Zhu, a freelance journalist based in Nairobi, discusses reporting on gender, urban inequality, and China–Kenya relations, including violence in informal settlements and the need for nuance in China-Africa discourse."
"2322","NüVoices Podcast #36: Mobility for Africa, with Shantha Bloemen","Shantha Bloemen, founding director of Mobility for Africa, discusses South-South development, gender-driven social enterprise, China's role in Africa, and renewable energy with NüVoices board member Chenni Xu."
"2330","NüVoices and YCW London presents: Gender and climate change in China","NüVoices and Young China Watchers London hosted a digital panel on gender and climate change in China, featuring journalist Karoline Kan and climate activist Zongqi Yu, moderated by Jessie Lau."
"2343","NüProfile: Grace Ly speaks about Chinese identities in France, anti-Asian racism, and exploring culture through food","Writer and podcaster Grace Ly discusses growing up Chinese-Cambodian in France, confronting anti-Asian racism, and reconnecting with her cultural heritage through food and storytelling."
"2357","NüVoices Podcast #37: Chinese cuisine in America, with Simone Tong","Cindy talks with chef Simone Tong, co-owner of Little Tong Noodle Shop and Silver Apricot in New York, about her life as a restaurateur during the pandemic, Chinese cuisine and identity in America, and the inspiration behind her food."
"2364","Please support NüVoices, registered non-profit","NüVoices announces its official recognition as a U.S. 501(c)(3) non-profit, making donations tax-deductible, and outlines ways to support its work through Patreon or PayPal."
"2401","IN PHOTOS: Capturing culture in Tibet as a French Canadian, Han Chinese tourist","A French-Canadian Chinese adoptee documents Tibetan culture in Qinghai province, photographing the complex dynamics between Han Chinese tourists and local Tibetan communities during a 2017 trip."
"2467","WATCH: Gender and climate change in China","A panel discussion exploring the intersection of gender and climate change in China, featuring journalist Karoline Kan and climate activist Zongqi Yu on how women and young people navigate environmental issues."
"2478","NüVoices Podcast #38: Fulbright’s exit from China and Hong Kong","This episode examines the cancellation of the Fulbright program in China and Hong Kong, featuring a panel of former scholarship recipients who discuss the program's significance and the impact of its loss on U.S.-China educational exchange."
"2491","NüProfile: Jinghua Qian on why ""China-watching"" is problematic, inclusion and un-belonging in Australia","Writer and journalist Jinghua Qian reflects on reporting in and on China, the problems with ""China-watching,"" diaspora representation, and navigating identity and un-belonging in Australia."
"2498","Review: Mulan reinforces Han ethnonationalism and the patriarchy","A critical review of Disney's Mulan examining historical inaccuracies in the film and arguing it reinforces Han ethnonationalism by erasing the original ballad's non-Han origins."
"2500","NüVoices Podcast #40: What’s next for Hollywood and China after ‘Mulan’ flop, with Becky Davis","Joanna Chiu speaks with Variety's China bureau chief Rebecca Davis about the Mulan remake's disappointing box-office performance in China and the future of Hollywood-China film collaborations amid rising U.S.-China tensions."
"2524","Review: My Prince Edward, a modern Hong Kong love story by writer-director Norris Wong","A review of My Prince Edward, a Hong Kong film by writer-director Norris Wong that explores female agency and societal expectations through the story of a couple falling out of love."
"2527","NüVoices Podcast #41: Development finance and Chinese identity, with Yunnan Chen","Yunnan Chen of the Overseas Development Institute joins Cindy to discuss China-Africa development finance, her fieldwork in Africa, and reflections on Chinese identity and growing up in the Asian diaspora in the UK."
"2547","NüVoices Podcast #42: Hong Kong media, redefined","This episode explores how journalists in Hong Kong have navigated the political shift following Beijing's national security legislation, featuring guest host Jennifer Creery of Hong Kong Free Press with reporters Mary Hui and Phoebe Kong."
"2553","WATCH: China's Black community speaks out on identity, racism and solidarity","Members of China's Black community share their experiences with identity, discrimination, and solidarity as the country's mainstream debate on racism grows amid global Black Lives Matter awareness."
"2561","NüVoices Podcast #43: Literary translation and language as resistance, with Anne Henochowicz","Anne Henochowicz discusses literary translation and language as resistance, exploring the translator's responsibility to original texts, the nuance of great translation, and COVID-19's impact on online discourse."
"2578","Losing a Grandmother, Learning Her Language","Tara Sun Vanacore reflects on her grandmother, influential Chinese-American novelist Yu Lihua, and how learning Mandarin deepened their bond and unlocked her grandmother's world."
"2659","NüVoices Podcast #39: Beijing Lights: A conversation with Huang Chenkuang","Anthony Tao speaks with journalist Huang Chenkuang about her interview series Beijing Lights, which profiles ordinary people on the margins of society in Beijing, exploring their stories, regrets, and dreams."
"2440","EXPLAINER: China's Domestic Violence Epidemic amid COVID-19","COVID-19 lockdowns sparked a surge in domestic violence across China. This explainer examines the history of anti-DV efforts and the cultural and legal challenges victims continue to face."
"2607","NüVoices Podcast #45: An uncertain future with guaranteed friction: U.S.-China economic coercion, with Ashley Feng","Researcher Ashley Feng joins NüVoices chair Joanna Chiu to discuss U.S.-China economic coercion, how tariffs and investment restrictions affect ordinary people, and what shifts in policy could mean after the 2020 U.S. election."
"2612","'Send me to the clouds' is a scathing indictment of the stigma surrounding leftover women","Teng Congcong's debut film Send Me to the Clouds follows a single woman in her 30s facing a cancer diagnosis, using her story to challenge the stigma of China's ""leftover women"" label while highlighting lives shaped by the One Child Policy."
"2627","NüVoices Podcast #46: Retail and e-commerce boom and bust in mainland and Hong Kong during COVID-19, with Tiffany Ap","Tiffany Ap, China bureau chief for Women's Wear Daily, joins to discuss the revival of fashion and retail in China post-lockdowns, the rise of e-commerce livestreaming, and Hong Kong's retail decline during COVID-19."
"2812","An unexpected outlet: The Chinese theatre troupe creating safe spaces for marginalized voices","A theatre collective from Guangzhou invites audience members to share personal stories, then improvises performances in response, creating safe spaces for marginalized communities in China."
"2829","Anthropologist: Taiwanese identity is a 'paradox' of conflicting beliefs – but social bonds create unity","An anthropologist's fieldwork in Taiwan reveals that national and cultural identities are more complex than political headlines suggest, with social bonds uniting people despite conflicting beliefs."
"2835","NüVoices Podcast #47: Women in fintech, with Rita Liu","Rita Liu, a fintech executive with experience at American Express, Alipay, and Mode Bank, discusses the early days of Chinese fintech, the industry's future, and gender representation in finance with NüVoices board member Chenni Xu."
"2861","NüVoices Podcast #48: U.S.-Taiwan relations: From Trump to Biden","Experts Margaret Lewis and Jessica Drun join host Joanna Chiu to discuss the lifting of U.S. restrictions on Taiwan exchanges and what the policy shift means for U.S.-Taiwan relations during the transition from Trump to Biden."
"2869","Virtual events for Te-Ping Chen's story collection, Land of Big Numbers","Virtual events celebrating Te-Ping Chen's debut short story collection ""Land of Big Numbers,"" featuring book launch details, reviews, and upcoming book talks for this acclaimed work about modern China and its diaspora."
"2883","Opinion: As a female artist, I kept shortchanging myself. Now, I try to know my value","Artist Jane Peng recounts how she consistently underpriced her paintings early in her career, discovering buyers would have paid far more, and examines why women often undervalue their professional worth."
"2888","NüVoices Podcast #49: Walking through development mandalas in the eastern Tibetan Plateau, with Pamela Logan","Dr. Pamela Logan discusses her book Compassion Mandala and her experience running Kham Aid Foundation in the eastern Tibetan Plateau, exploring education, healthcare, poverty alleviation, and heritage preservation."
"2895","NüVoices Podcast #50: Directing ""Finding Yingying"", with Jenny Shi","Filmmaker Jenny Shi discusses directing her award-winning documentary Finding Yingying, her creative process, and the emotional demands of documentary filmmaking."
"2902","Review: Te-Ping Chen's ""Land of Big Numbers"" sketches the diversity of modern China","A review of Te-Ping Chen's debut short story collection Land of Big Numbers, which portrays the diverse interior lives of individuals in modern China, drawn from her experience as a journalist in Beijing and Hong Kong."
"2914","Translation: Poems by Chinese feminist and revolutionary writer Qiu Jin","A collection of poems by Qiu Jin, a Chinese feminist and revolutionary writer, translated into English by Yilin Wang."
"2955","Resources to fight anti-East, Southeast Asian & Pacific Islander racism","A compilation of resources for combating anti-East Asian, Southeast Asian, and Pacific Islander racism, including organizations supporting sex workers and migrants, bystander intervention guides, and community toolkits."
"2988","In China, pole dancing evolved from a male art practice in the Song Dynasty to an inclusive sport promoting body positivity","Pole acrobatics in China trace back to the Song Dynasty as a male-only art. Today, modern pole dance is expanding across Chinese cities as an inclusive fitness option promoting body positivity."
"2992","NüVoices Podcast #52: Talking fiction writing and modern China, with Te-Ping Chen","Te-Ping Chen discusses her debut story collection Land of Big Numbers, drawing on her experience as a Wall Street Journal correspondent in Beijing and Hong Kong to explore modern Chinese life through fiction."
"3016","Amy Sommers on her debut historical novel, Rumors from Shanghai","Amy Sommers discusses her debut historical novel Rumors from Shanghai, which follows a Black American lawyer who moves to 1940s Shanghai after facing professional barriers in the Pacific Northwest."
"3028","NüVoices Podcast #54: Telling Asian and Asian-American stories through video journalism, with Dolly Li","Dolly Li, award-winning video journalist and co-founder of Goldthread, discusses visual storytelling, documenting multi-generational immigrant and Asian-American stories, and navigating her evolving identity while living and working around the world."
"3031","Young China Watchers event: A Discussion of LGBTQ+ Progress and Activism in China","A Young China Watchers panel featuring Ivy Wong, Jessie Lau, and AJ Song examined LGBTQ+ progress, workplace inclusion, and ongoing activism in mainland China, Hong Kong, and the broader region."
"3050","NüVoices Podcast #55: Unraveling Australia-China relations, with Natasha Kassam","Joanna Chiu and former diplomat Natasha Kassam discuss the sharp decline in Australia-China relations and how rising diplomatic tensions have disproportionately impacted Chinese-Australians."
"3060","Introducing: The 异乡人 (Yi Xiang Ren) podcast featuring immigrant stories","异乡人 (Yi Xiang Ren) is a Mandarin-language podcast by Bessie Du featuring stories of Chinese immigrants worldwide, exploring themes of identity, culture, and the personal journeys of those who built lives far from their birthplaces."
"3069","Censoring feminist discussions will not solve China’s population crisis","China's crackdown on feminist groups like 6B4T on social media has increased visibility for radical feminism rather than curbing it, suggesting the government should address discrimination against women to tackle its population decline."
"3074","NüVoices Podcast #56: Censorship and resistance, with Sophie Beach","Sophie Beach, executive editor of China Digital Times, discusses the organization's origins, evolving state censorship tactics, and efforts to amplify voices of resistance from Chinese internet users."
"3078","NüVoices Podcast #57: Revolutionary feminism, wuxia, and the politics of translation, with Yilin Wang","Yilin Wang discusses their work as a writer and Chinese-English translator, covering revolutionary feminist Qiu Jin's poetry, the #LiteraryJianghu Project promoting wuxia literature, and the politics of translation in North America."
"3087","Exhibition and Live Discussion with Iris Yau: ‘Opium, Silk and the Missionaries in China’","The Brunei Gallery at SOAS presents ""Iris's Silk Route,"" an exhibition by curator Iris Yau featuring 97 items from global archives exploring the forgotten history of opium, silk, and missionaries between Britain and China in the 19th century, accompanied by a live gallery discussion."
"3100","An Ode to Sound: NüVoices podcast co-host Cindy Gao on audio storytelling","NüVoices podcast co-host Cindy Gao shares her approach to audio storytelling, from interview preparation to the challenges of consistent podcast production, in this excerpt from the Chinese Storytellers newsletter."
"3105","NüVoices Podcast #58: The shrinking China foreign press corps, and reporting in Xinjiang, with Sophia Yan","Journalist Sophia Yan discusses the shrinking foreign press corps in China and shares findings from her reporting in Xinjiang on the persecution of Uyghurs, forced labor, and press obstruction."
"3109","Introducing ‘Hong Kong Silenced’: a new Telegraph podcast documenting Beijing's crackdown","""Hong Kong Silenced"" is a four-part Telegraph podcast, anchored by NüVoices board member Sophia Yan, documenting how the National Security Law has changed life for Hong Kongers."
"3115","NüVoices Podcast #59: COVID-19 origins and the state of science reporting in China, with Kathleen McLaughlin","Kathleen McLaughlin and Rui Zhong discuss the origins of COVID-19 and the state of science reporting in China, including government handling of past scientific controversies."
"3121","NüVoices Podcast #60: Getting tea drunk, with Shunan Teng","Shunan Teng, founder of Tea Drunk in New York City, discusses her expertise in heritage and historical teas, the six major types of tea, production techniques, and how to approach tasting tea."
"3125","CONTRIBUTE TO CHINA BRIEF: Our five tips for policy writing","Elizabeth Chen, editor of the Jamestown Foundation's China Brief, shares five practical tips for writing effective policy analysis, from maintaining a clear narrative to grounding arguments in fact-based research."
"3141","NüVoices Podcast #61: Decoding Chinese technology policy, with Lotus Ruan","Lotus Ruan of the Citizen Lab joins Rui Zhong to discuss her research on Chinese app privacy, Apple's strategy in China, and the complexities of navigating China's technology policy process."
"3145","Queer East Film Festival aims to amplify Asian communities in the UK","The Queer East Film Festival screens 37 films from 15 countries, showcasing queer stories from East and Southeast Asia. The UK-based festival aims to amplify Asian voices and bridge cultural understanding through cinema and panel discussions."
"3150","Book Excerpt: 'More Than One Child' by Shen Yang","An excerpt from Shen Yang's memoir recounts her childhood as an ""excess child"" born in violation of China's One-Child Policy, forced to hide from family planning officers while living with her grandparents."
"3155","APPLY: Queer China UK's Transnational Chinese Queer Leadership Programme","Queer China UK opens applications for its Transnational Chinese Queer Leadership Programme, a four-month mentorship pairing participants with international professors, activists, and LGBTQ+ leaders through Zoom workshops."
"3162","NüVoices Podcast #62: Eat the Buddha: A conversation with award-winning author Barbara Demick","Author and journalist Barbara Demick discusses her book Eat the Buddha, which chronicles life in the Tibetan town of Ngaba, exploring decades of Tibetan and Chinese history and what it means to be Tibetan today."
"3170","As China's landmark #MeToo case is dismissed in court, it's clear the legal system must do more for survivors","Zhou Xiaoxuan, the face of China's #MeToo movement, lost her landmark sexual harassment case in a Beijing court. The ruling underscores the evidentiary challenges survivors face in China's legal system."
"3176","NüVoices Podcast #63: China-New Zealand Relations with NZ Ambassador Clare Fearnley","New Zealand's Ambassador to China Clare Fearnley discusses bilateral relations, her extensive diplomatic career across Asia, and New Zealand's gender equality progress."
"3190","NüVoices chair Joanna Chiu on the launch of CHINA UNBOUND","NüVoices chair Joanna Chiu announces the publication of China Unbound, drawing on a decade of reporting across four continents to examine Beijing's global influence, authoritarianism, and U.S.-China competition."
"3130","Review: Han Chinese filmmaker Wang Lina's ""A First Farewell"" is an uneasy depiction of Uyghur childhood","A review of Wang Lina's 2019 film ""A First Farewell,"" which follows two Uyghur children navigating change in Xinjiang, and examines the political dimensions of depicting Uyghur life in Chinese cinema."
"3195","NüVoices Podcast #64: China Unbound: A Conversation with Joanna Chiu and Madeleine O'Dea","Joanna Chiu discusses her book China Unbound with guest host Madeleine O'Dea, exploring China's global rise, Western policy failures, and diaspora storytelling perspectives."
"3202","NüVoices Podcast #65: Xinjiang, HK, and Sanctions with Sophie Richardson, China Director of Human Rights Watch","Sophie Richardson, China Director of Human Rights Watch, joins journalist Sophia Yan to discuss human rights in China, international sanctions, and how HRW supports staff wellbeing."
"3207","Book Excerpt: 'Feminisms with Chinese Characteristics'","An excerpt from 'Feminisms with Chinese Characteristics' by Ping Zhu and Hui Xiao, exploring the diverse feminist movements that have emerged in China since the mid-1990s and their relationship to state feminism."
"3217","NüVoices Podcast #66: Translating Jin Yong's Legends of the Condor Heroes with Gigi Chang and Shelly Bryant, Part 1","Gigi Chang and Shelly Bryant discuss translating Jin Yong's wuxia epic Legends of the Condor Heroes from Chinese to English, including the challenges of rendering elaborate fight scenes and the series' cultural significance."
"3223","LONDON PANEL: ""China Unbound"" book launch with author Joanna Chiu, in conversation with Megha Rajagopalan","A London panel event featuring NüVoices chair Joanna Chiu discussing her book ""China Unbound"" on China's global influence, in conversation with Pulitzer prize-winning journalist Megha Rajagopalan at SOAS University."
