"post_id","title","description"
"430","Breaking through the publishing glass ceiling: A tribute to my literary agent","Sheridan Prasso remembers her late literary agent Elaine Markson, a pioneering feminist who championed women writers and broke barriers in the male-dominated publishing world."
"439","Travel Essay: Hiking Huangshan helped me conquer the mountain within","Betty Xiao travels solo to central China's Huangshan to hike Yellow Mountain, pushing past others' concerns and her own doubts to take on the challenging climb."
"452","Female artists and writers reflect on feminist art and journalism","Female artists and a journalist explore how feminism shapes their creative and reporting practices at a NüVoices panel discussion on art, performance, and media in China."
"456","Fiction Excerpt: Tender Darling","A fiction excerpt following an American expat apartment-hunting in Shanghai, where her British-Chinese landlord's candid remarks reveal complex tensions around identity, race, and belonging."
"540","NüVoices Podcast #1: News assistants in China","In this debut episode, hosts Alice Xin Liu and Joanna Chiu interview two Chinese women working as news assistants for foreign media and discuss the origins and mission of the NüVoices editorial collective."
"543","NüVoices Podcast #2: China’s #MeToo momentum, with Yuan Yang","NüVoices Podcast episode two features hosts Alice Xin Liu and Joanna Chiu interviewing Financial Times correspondent Yuan Yang about the #MeToo movement's spread across mainland China despite censorship and institutional pressure."
"547","NüVoices Podcast #3: Meet fantasy writer Mima, who aspires to create China’s Game of Thrones","Fantasy writer Mima discusses her novel The Legend of Strangers and its adaptation into a web series for Youku, joined by co-host Sophie Lu in this third episode of the NüVoices Podcast."
"550","NüVoices Podcast #4: Technology and bias with Christina Larson","Christina Larson joins Alice and Sophie to discuss technology and bias, covering China's social credit system, gender bias in artificial intelligence, and reproductive issues tied to economic policy."
"571","Shanghai NüVoices discussion salon","NüVoices held its Shanghai launch event in June at Bitter on Wu Yuan Lu, where attendees discussed personal experiences with sexism and brainstormed workplace actions to combat gender inequality."
"575","NüVoices launches in Hong Kong","NüVoices, a collective supporting women writers and artists focused on China, celebrated its Hong Kong launch with discussions on gender representation in media and a directory of nearly 500 female experts."
"628","Berlin Stammtisch: Launch of Europe's NüVoices network","A recap of NüVoices' first Berlin Stammtisch, where members discussed improving China coverage in European media and brainstormed ideas for expanding the network, diversifying storytelling formats, and exploring funding options."
"644","A NüVoices gathering in Taipei","NüVoices held its first Taipei gathering, bringing together journalists, artists, and activists to discuss women's issues, gender equality, and Taiwan's visibility in international media."
"420","Hong Kong's lesbian spaces and the stories behind them","Benita Chick explores Hong Kong's hidden LGBTQ+ venues, tracing their connections to the city's history of secret meeting places and the cultural significance of spaces like T:ME Bar in Central."
"437","Five female Chinese artists explore femininity","Five artworks by female Chinese artists from Mainland China, Hong Kong, Taiwan, and Malaysia explore femininity, gender expectations, and the experiences that shape women."
"554","Personal Essay by a Chinese-American: Distances","Huizhong Wu reflects on growing up Chinese-American, navigating the cultural distance between her immigrant family's home and the familiar American households of her childhood friends."
"726","NüVoices community: October social gathering in Hong Kong","A recap of the NüVoices community's informal social gathering held in October 2018 in Hong Kong, where attendees discussed #MeToo developments in China, podcast ideas, and other topics over food and drinks."
"742","How to rock your broadcast appearance","Sophia Yan shares practical tips for appearing on broadcast television, from understanding live versus taped formats to handling earpieces and speaking to remote anchors."
"744","Loud Murmurs: A feminist Chinese podcast deconstructing US pop culture","A look at Loud Murmurs, a feminist Chinese podcast that critically analyzes US pop culture, exploring how American media has shaped the perspectives of Chinese audiences."
"747","Personal Essay by a Chinese adoptee: I returned to China to find my biological family and discover my cultural roots","A Chinese adoptee raised in francophone Quebec returns to China to search for her biological family and explore the cultural identity shaped by growing up between two worlds."
"768","NüVoices Podcast #5: Joan Xu on screenwriting in China","Joan Xu discusses her work as a screenwriter in Beijing, including China-Hollywood co-productions and her web series The Circle, in this episode hosted by Alice Xin Liu and Sophie Lu."
"788","NüVoices launches in New York November 1!","NüVoices, an international editorial collective focused on women working on China-related topics, announced its first North American chapter launch in New York on November 1, featuring a panel discussion on contemporary feminist organizing in China."
"823","Translation: Reflections on #MeToo and machismo violence by Peruvian writer Gabriela Wiener","Isolda Morillo translates Peruvian writer Gabriela Wiener's reflections on #MeToo and machismo violence, exploring the movement's global resonance from Latin America to China."
"834","NüVoices Podcast #6: Oral histories and family stories with Karoline Kan","Karoline Kan joins the NüVoices podcast to discuss oral histories, family storytelling, the personal essay genre, and her memoir Under Red Skies about three generations of life in China."
"838","Fiction Excerpt: Searching for Gao Meng","A student in Nanjing becomes captivated by the life of Chinese writer Ding Ling, whose feminist writings were censored after clashing with Mao's political demands."
"859","Madeleine O'Dea on her memoir The Phoenix Years, Chinese artists and the nation's transformation","Madeleine O'Dea discusses her memoir The Phoenix Years, which traces China's transformation over four decades through the stories of nine contemporary Chinese artists and their struggles for creative freedom."
"890","NüVoices Podcast #7: A rocket maker turned journalist, Lijia Zhang","In this episode, co-hosts Sophie Lu and Joanna Chiu interview author and journalist Lijia Zhang about her journey from rocket factory worker to award-winning writer giving voice to China's marginalized communities."
"893","Social: NüVoices London Dinner/Drinks","NüVoices hosted a dinner and drinks social in Central London on November 23, inviting those interested in China to connect, discuss current topics, and explore collaboration opportunities including an upcoming women's panel launch event."
"931","100+ attend NüVoices NYC launch and discussion on Chinese feminism","Over 100 people attended the NüVoices NYC launch at Verso Books in November 2018, featuring a panel discussion on contemporary Chinese feminism with Leta Hong Fincher, Rebecca Karl, and Lü Pin."
"960","NüVoices Podcast #8: Eleanor Goodman on the art of translating Chinese poetry","Eleanor Goodman discusses translating Chinese poetry, including her work on Wang Xiaoni and the workers' poetry anthology Iron Moon, plus her own poetry collection Nine Dragon Island."
"964","Community: A NüVoices gathering in London","NüVoices held its first London social gathering on November 23, bringing together over 25 China watchers, creators, academics, and activists to connect professionals interested in amplifying women's voices in China-related fields."
"1032","NüVoices Podcast #9: Long-Form Magazine Writing With The New Yorker’s Jiayang Fan","Alice Xin Liu and Joanna Chiu speak with New Yorker staff writer Jiayang Fan about her immigrant background, long-form magazine writing on China, and the landscape of Asian-American writing."
"1232","NüVoices Podcast #10: All-female improv group ""Beijing Broads""","NüVoices Podcast episode 10 features an interview with Anete and Silvia of Beijing Broads, an all-female improv group, discussing comedy in China, supporting women performers, and the charity Educating Girls of Rural China."
"987","Personal Essay by a Chinese daughter: The half-truths we tell in times of sickness","Wang Zhen reflects on her family's collective decision to conceal the severity of her mother's brain cancer diagnosis, exploring how half-truths became acts of love and protection."
"1011","Short Story from a Queer Woman: Tearing","A married woman recounts falling for a woman nicknamed Ostrich, met through a running club in China, navigating unexpected queer desire and the painful unraveling of a love triangle."
"1040","Opinion: Why women are leaving Hong Kong tech companies","Athena Lam examines why women are leaving Hong Kong's tech industry, exploring the structural barriers, gender gap among graduates, and workplace challenges driving female talent away."
"1066","NüYear Drinks in DC - Welcome NüVoices to the US Capital!","NüVoices hosted a Lunar New Year gathering in Washington, DC on February 4, 2019, marking the launch of its DC chapter with drinks, snacks, and discussion at Petworth Citizen & Reading Room."
"1082","NüVoices and YCW London invites you to our China careers wanel","NüVoices and Young China Watchers London co-host a women's panel on building China-related careers, featuring experts from media, academia, and government discussing industry insights and gender equity in the workplace."
"1098","NüVoices of the Diaspora: An evening of storytelling in NYC","NüVoices of the Diaspora was a storytelling event in NYC featuring artists Muna Tseng, Alvin Eng, Karoline Kan, and Angel Yau, with readings, spoken word, and music exploring diaspora experiences, hosted at the Museum of Chinese in America."
"1109","Meet the queer women organizers of Shanghai's LGBTQ community","A profile of four women at the center of Shanghai's LGBTQ community, including Roxie's founder Ting Ting Liang, exploring how they work to strengthen visibility and support for the city's queer community."
"1114","Women experts discuss gender issues and how to build successful China-related careers in London Wanel","Three women experts in media, academia, and consulting discuss building China-related careers and gender issues at a NüVoices and Young China Watchers London panel event."
"1128","NüVoices invites you to our London Launch Wanel ""Being feminist in China: Gender issues across generations""","NüVoices hosted a London launch panel exploring feminism in China across generations, examining gender inequality, the #MeToo movement, feminist activism, and gender-based violence in contemporary Mainland China and Hong Kong."
"1195","NüVoices DC Event: Life under Chinese Rule in Xinjiang","A NüVoices DC event featuring Zubayra Shamseden and Irade Kashgary discussing their personal experiences as Uyghur women living under Chinese rule in Xinjiang, moderated by Elise Anderson."
"1209","WATCH: Over 80 attend NüVoices London launch wanel ""Being feminist in China: Gender issues across generations""","Over 80 people attended NüVoices' London launch at SOAS, featuring a panel on feminism in China with speakers discussing gender inequality, #MeToo, and women's changing roles across generations."
"1225","Q&A with NüVoices board member Karoline Kan, author of Under Red Skies","Karoline Kan, NüVoices board member and former New York Times reporter, discusses her debut memoir Under Red Skies, which traces three generations of her family's experiences navigating poverty, policy, and social change in modern China."
"1237","DC Event recap: Uyghur women on the ongoing human rights crisis in their homeland","A recap of the inaugural Washington DC NüVoices chapter panel featuring two Uyghur women and a moderator discussing the ongoing human rights crisis affecting Uyghur communities, including cases of political prisoners and diaspora experiences."
"1256","NüVoices Podcast #11: Queer culture, perception, and representation within China, with Alex Li","Alex Li of Vice China joins to discuss queer culture, bisexuality, and LGBTQ+ representation in Chinese media, along with self-care recommendations."
"1346","NüVoices London wanel ft. board member Karoline Kan, author of Under Red Skies","NüVoices and Young China Watchers London co-hosted a panel discussion with Karoline Kan about her memoir ""Under Red Skies,"" the first English-language memoir by a Chinese millennial."
"1852","Event Recap: NüVoices' Hong Kong chapter talks #MeToo and LGBT issues in China","NüVoices' Hong Kong chapter held an open discussion on October 4, where twelve members from law, media, business, and academia shared perspectives on the #MeToo movement and LGBT issues in China and Hong Kong."
"2722","NüVoices Podcast #12: Shui, on Beijing's 'zine scene","In this episode, Shuilam Wong (Shui) discusses co-founding the Hole in the Wall Collective with Jinna Kaneko to create indie zines in Beijing, her multicultural upbringing, and her comic art style inspired by Old Master Q."
"2733","NüVoices Podcast #13: ‘Black Mirror’ China and Dystopian Female Futures with Cate Cadell","Cate Cadell joins the NüVoices podcast to discuss Chinese government surveillance, its impact on women, and the ethics of emerging technologies like CRISPR and AI in a wide-ranging conversation."
"2738","NüVoices Podcast #14: Women and Chinese Sci-Fi: Live at the Bookworm with Tang Fei and Ji Shaoting","A live episode from the Beijing Bookworm Literary Festival featuring science fiction authors Tang Fei and Ji Shaoting discussing the challenges facing female Chinese sci-fi writers, including gender discrimination and expanding the market for Chinese science fiction."
"2744","NüVoices Podcast #15: Rocking while female, with Anlin Fan of Xiao Wang (小王)","Co-host Alice Xin Liu interviews Anlin Fan, co-founder and lead singer of Chinese rock band Xiao Wang, about growing up in China, the Riot Grrrl movement, starting a band, and feminism and intersectionality."
"1365","Carving out Chinese ideals of female beauty: Visualizations by Artist Su Yang","Artist Su Yang uses large-scale self-portraits and video to examine China's growing cosmetic surgery industry and challenge prevailing beauty standards imposed on women."
"1385","Five podcasts on LGBTQ+ culture in Greater China","A guide to five podcasts exploring LGBTQ+ culture in Mainland China, Taiwan, and Hong Kong, with a focus on queer women's visibility and community-building in the region."
"1413","Overseas Chinese reflect on China's #MeToo Movement from the United States","Chinese students and professionals in the U.S. reflect on China's #MeToo movement, sharing perspectives on sexual harassment, gender issues, and the challenges of activism under government censorship."
"1428","Taiwan's lesbian sex toy and divination shop strives to help queer women accept themselves","Love Boat is a Taipei shop for queer women offering sex toys, divination, and healing services. Founded in 2004, it aims to help LGBTQ+ women embrace their identities."
"1466","NüVoices DC Event: Gelato Social & Museum Hop","A NüVoices DC community event featuring gelato at the Hirshhorn Museum followed by a guided visit to the ""Empresses of China's Forbidden City"" exhibit at the Freer & Sackler Galleries."
"1472","Making it personal: A life writing workshop with Madeleine O’Dea in London","A free life writing workshop led by journalist and author Madeleine O'Dea, held in London on July 3, 2019, covering the challenges of memoir writing with tips, discussion, Q&A, and a book signing."
"1488","Full house of 70+ welcome board member and author Karoline Kan at London wanel","Over 70 attendees gathered at King's College London for a panel co-hosted by NüVoices and Young China Watchers, where board member and author Karoline Kan discussed her memoir Under Red Skies."
"1533","Fiction: A brother comes to visit","Jessie Tu's short fiction follows a woman navigating loneliness and self-doubt while living with an older man, as a visit from her brother prompts quiet reflection over dumplings on a cold winter night."
"1540","NüVoices Podcast #17: Legal advocacy against domestic violence in China, with Siodhbhra Parkin","Siodhbhra Parkin discusses her legal advocacy work against domestic violence in China, the impact of NGO regulations, and efforts to support Chinese rule of law activists and anti-domestic-violence campaigners."
"1589","James Griffiths, author of The Great Firewall of China, discusses censorship and China's women's movement","Author James Griffiths discusses how China's censorship system impacts feminist and activist movements, and how activists find creative ways to circumvent online controls."
"1603","10 Tips for writing life stories from Madeleine O'Dea, author of The Phoenix Years","Madeleine O'Dea shares 10 practical tips for writing memoirs, drawn from her experience authoring The Phoenix Years, focusing on how vivid details build emotional connection with readers."
"1632","Q&A: Young women discuss gender and education in China today","Young women in China discuss their experiences with gender inequality in education and the workforce, highlighting an urban-rural divide in progress toward gender parity."
"1636","B人BEL Magazine Call for Submissions","B人BEL Magazine opens submissions for its second issue, seeking written, photographic, and illustrated stories about underrepresented communities in China, with a deadline of August 31."
"1639","Event Recap: Lü Pin on the Chinese feminist movement's strategies in China and the US","A recap of a NüVoices DC gathering where activist Lü Pin discussed the Chinese feminist movement's organizing strategies, online activism, and opportunities for cross-border solidarity."
"1644","“Your Mother Sacrificed Herself for the Country” – The Idealization of the Female Martyr in China ","This article explores the idealization of female martyrs in China through the figure of Zhao Yiman, a CCP revolutionary celebrated for her resistance to Japanese occupation in 1930s Manchuria."
"1667","Sinobabble Podcast Call for Guest Speakers","Sinobabble, a podcast exploring China's history, politics, society, and culture, invites knowledgeable guest speakers to share their expertise on any area of Chinese studies."
"1680","THEATRE: Chinese creators present ""No Foreigners,"" a show using shopping malls as a portal for telling Chinese diaspora stories","""No Foreigners"" is a multimedia performance by Chinese diaspora creators in Toronto that explores North American Chinese shopping malls as spaces of cultural memory, loss, and resilience through interwoven storylines spanning languages, cities, and generations."
"1690","OPEN CALL: Seeking HK-based Artist for residency at the Centre for Chinese Contemporary Art in Manchester, UK","The British Council Hong Kong, CFCCA, and Phillips invited Hong Kong-based artists to apply for a fully funded 9-week residency at the Centre for Chinese Contemporary Art in Manchester, focused on socially engaged practices."
"2756","NüVoices Podcast #16: The musical life and career of director Zou Shuang (邹爽)","A conversation with director and playwright Zou Shuang, artistic director of the Beijing Music Festival, about her musical upbringing, opera career, and work adapting European musical theater for Chinese audiences."
"2763","NüVoices Podcast #18: Cultivating community in corporate culture, with Chenni Xu","Chenni Xu, corporate communications head for Alipay in North America, discusses navigating corporate culture, building peer networks, finding mentorship, and ensuring your voice is heard in the workplace."
"1709","Call for nominations: Young China Watcher of the Year Award","Young China Watchers announces its second annual Young China Watcher of the Year Award, seeking nominations for young professionals who have contributed to the global understanding of China."
"1714","Navigating my biracial identity as a Chinese-American living in China","Megan Cattel reflects on navigating her biracial Chinese-American identity while living in Shanghai, exploring how perceptions of her race shift depending on where she is in the world."
"1733","Paper Republic: A collective of translators promoting Chinese literature","Paper Republic is a UK-registered charity and translator collective founded in 2007 that promotes contemporary Chinese literature in English through free online translations, a bibliographic database, and literary events."
"1736","NüVoices London Presents: China's underground sex industry and Lotus with Lijia Zhang","NüVoices London hosts a discussion with author Lijia Zhang on her debut novel Lotus, exploring China's underground sex industry, the legal system surrounding it, and the social factors driving its growth."
"1766","Postcard Campaign: Free journalist and #MeToo activist Sophia Huang Xueqin","A postcard campaign organized by NüVoices DC calls for international support for Sophia Huang Xueqin, a feminist journalist and #MeToo activist detained in Guangzhou, China, in October 2019."
"1780","Board Member Karoline Kan Wins 2019 Young China Watcher of the Year","Board member Karoline Kan, Beijing editor at China Dialogue and author of Under Red Skies, was named 2019 Young China Watcher of the Year for her work sharing nuanced perspectives on China and Chinese millennials with international audiences."
"1784","NüVoices Podcast #20: Contemporary Chinese art and techno-orientalism with Xin Wang","Xin Wang, a teaching fellow at the Whitney Museum and NYU Ph.D. student, joins Chenni Xu and Cindy Gao to discuss contemporary Chinese art, Asian futurism, and techno-orientalism."
"1791","Introducing MADE IN: A new podcast promoting Asian-Canadian stories","MADE IN is a podcast by Evelyn Kwong exploring Asian-Canadian identity, featuring conversations on beauty standards, the model minority myth, and the experiences of Asian women navigating life in North America."
"1798","Packed room of 40+ joined London Wanel featuring Lijia Zhang on Lotus and China's sex trade","Author Lijia Zhang discussed her novel Lotus and China's sex trade at a NüVoices wanel in London, moderated by Jessie Lau, drawing over 40 attendees to SOAS on November 7."
"1814","NüVoices Podcast #21: Sino-Black relations with Keisha Brown","Keisha Brown, historian and fellow at the National Committee on U.S.-China Relations, discusses the history of Sino-Black relations, influential African Americans' ties to China, and changing perceptions of race and identity in China."
"1818","Director and screenwriter Wu Nan talks gender, storytelling and her first feature film ""Push and Shove 狗眼看人心""","Wu Nan reflects on gender challenges in China's film industry and her path from two decades of screenwriting to directing her debut feature, Push and Shove (2019)."
"1824","Girl, Interpreted: a new bilingual comedy web series made in Melbourne","Girl, Interpreted is a bilingual Mandarin-English comedy web series from Melbourne about an interpreter navigating cultural clashes and misunderstandings during unexpected assignments."
"1847","NüVoices Podcast #23: Reimagining Hong Kong’s political communities","Jessie Lau joins Joanna Chiu to discuss generational divides over the Hong Kong protests, their impact on families, and how the movement reshaped ideas of Hongkonger identity and diaspora belonging."
"1857","In pictures: Behind the frontlines of the Hong Kong protests","A photo essay by Katherine Cheng documenting moments from behind the frontlines of Hong Kong's pro-democracy protests, which began in June 2019 over a proposed extradition bill."
"1904","NüVoices Podcast #24: Chinese philanthropy in the 21st century, with Emily Weaver","Emily Weaver, a philanthropy consultant with over a decade in China, discusses individual and digital giving, women's roles in philanthropic work, and the impact of China's 2016 foreign NGO law."
"1916","I am a Wuhan girl","A journalist from Wuhan living in Hong Kong reflects on her family under coronavirus lockdown, speaks against rising discrimination toward Chinese people, and shares fond memories of her hometown's culture and food."
"1923","NüVoices Podcast #25: A wealth of anger and a wealth of time – Wuhan and the coronavirus, with Rui Zhong","Rui Zhong of the Wilson Center joins co-host Cindy Gao to discuss the COVID-19 timeline, Chinese government narrative tactics, those most affected within China, and xenophobic responses toward Chinese people worldwide."
"1926","London's Papergang Theatre presents FREEDOM HI 自由閪: A show exploring the Hong Kong protests","Papergang Theatre's FREEDOM HI 自由閪 is a compilation of new writing and performance art by UK-based Hong Kong and British East Asian artists exploring the Hong Kong protests and the diasporic experience."
"1943","Essay: Thrift Stor(i)es","Grace Ouyang explores the cultural taboo around secondhand clothing in Chinese culture through personal stories of her family's laundromat in Queens and her own thrifting habits."
"2654","NüVoices Podcast #19: Leading by example: Female success in the workplace, with Rachel Morarjee","Rachel Morarjee, director of the Economist Corporate Network and former FT correspondent, discusses the 30% Club's work to increase women in leadership roles, navigating modern workplaces, and her transition from journalism."
